{
  "specMeta": {
    "specName": "GTRS",
    "specVersion": "1.0.0",
    "compatibleVersion": "1.0.0"
  },
  "themeInfo": {
    "themeId": "stack_theme_default",
    "ownerType": "GAME",
    "ownerId": 0,
    "themeName": "堆叠天空",
    "isDefault": true,
    "gameId": "stack",
    "description": "kids-game-simple stack 默认 GTRS"
  },
  "globalStyle": {
    "primaryColor": "#A8E6CF",
    "secondaryColor": "#FFD700",
    "bgColor": "#87CEEB",
    "textColor": "#FFFFFF",
    "fontFamily": "Arial, sans-serif"
  },
  "resources": {
    "images": {
      "login": {},
      "scene": {
        "background": { "src": "#87CEEB", "type": "png", "alias": "天空" },
        "background_dark": { "src": "#5DADE2", "type": "png", "alias": "深天空" },
        "hud_bg": { "src": "rgba(0,0,0,0.45)", "type": "png", "alias": "HUD" },
        "accent": { "src": "#FFD700", "type": "png", "alias": "完美高亮" },
        "danger": { "src": "#FF6B6B", "type": "png", "alias": "危险" },
        "muted": { "src": "#B0B0B0", "type": "png", "alias": "普通块" },
        "game_palette": {
          "src": "[\"#FF6B6B\",\"#FFD93D\",\"#6BCB77\",\"#4ECDC4\",\"#9B59B6\",\"#FF8E53\",\"#3498DB\",\"#E74C3C\"]",
          "type": "png",
          "alias": "堆叠色板"
        }
      },
      "ui": {},
      "icon": {},
      "effect": {}
    },
    "audio": { "bgm": {}, "effect": {}, "voice": {} },
    "video": {}
  }
}
