{
  "specMeta": {
    "specName": "GTRS",
    "specVersion": "1.0.0",
    "compatibleVersion": "1.0.0"
  },
  "themeInfo": {
    "themeId": "{{gameId}}_theme_default",
    "ownerType": "GAME",
    "ownerId": 0,
    "themeName": "{{gameId}} 默认主题",
    "isDefault": true,
    "description": "由策划槽位表生成，替换 src 与 globalStyle 即可换肤",
    "gameId": "{{gameId}}"
  },
  "globalStyle": {
    "primaryColor": "#4CAF50",
    "secondaryColor": "#6BCB77",
    "bgColor": "#1a1a2e",
    "textColor": "#ffffff",
    "fontFamily": "Arial, sans-serif",
    "borderRadius": "8px"
  },
  "resources": {
    "images": {
      "login": {},
      "scene": {
        "accent_palette": {
          "src": "[\"#FF6B6B\",\"#FFD93D\",\"#6BCB77\",\"#4ECDC4\"]",
          "type": "png",
          "alias": "accent_palette"
        }
      },
      "ui": {},
      "icon": {},
      "effect": {}
    },
    "audio": {
      "bgm": {},
      "effect": {},
      "voice": {}
    },
    "video": {}
  }
}