{
  "specMeta": {
    "specName": "GTRS",
    "specVersion": "1.0.0",
    "compatibleVersion": "1.0.0"
  },
  "themeInfo": {
    "themeId": "neonRun_theme_default",
    "ownerType": "GAME",
    "ownerId": 0,
    "themeName": "霓虹奔跑",
    "isDefault": true,
    "gameId": "neonRun",
    "description": "kids-game-simple neonRun 默认 GTRS"
  },
  "globalStyle": {
    "primaryColor": "#00FFFF",
    "secondaryColor": "#FFD700",
    "bgColor": "#0a0a0f",
    "textColor": "#E0E7FF",
    "fontFamily": "Arial, sans-serif"
  },
  "resources": {
    "images": {
      "login": {},
      "scene": {
        "grid_line": { "src": "rgba(100, 100, 255, 0.1)", "type": "png", "alias": "网格线" },
        "lane_line": { "src": "rgba(0, 255, 255, 0.3)", "type": "png", "alias": "赛道线" },
        "player_glow": { "src": "#00FFFF", "type": "png", "alias": "玩家光晕" },
        "hud_bg": { "src": "rgba(0,0,0,0.5)", "type": "png", "alias": "HUD" },
        "danger": { "src": "#FF4757", "type": "png", "alias": "危险" },
        "muted": { "src": "#8B0000", "type": "png", "alias": "暗色障碍" },
        "game_palette": {
          "src": "[\"#FF4757\",\"#8B0000\"]",
          "type": "png",
          "alias": "障碍色板"
        }
      },
      "ui": {},
      "icon": {},
      "effect": {}
    },
    "audio": { "bgm": {}, "effect": {}, "voice": {} },
    "video": {}
  }
}
