{
  "specMeta": { "specName": "GTRS", "specVersion": "1.0.0", "compatibleVersion": "1.0.0" },
  "themeInfo": {
    "themeId": "memoryMatch_theme_default",
    "ownerType": "GAME",
    "ownerId": 0,
    "themeName": "翻牌配对",
    "isDefault": true,
    "gameId": "memoryMatch"
  },
  "globalStyle": {
    "primaryColor": "#A29BFE",
    "bgColor": "#0f0c29",
    "textColor": "#FFFFFF"
  },
  "resources": {
    "images": {
      "login": {},
      "scene": {
        "accent": { "src": "#A29BFE", "type": "png", "alias": "强调色" },
        "hud_bg": { "src": "rgba(0,0,0,0.45)", "type": "png", "alias": "HUD" },
        "danger": { "src": "#FF6B6B", "type": "png", "alias": "警告" },
        "game_palette": {
          "src": "[\"#FF6B6B\",\"#4ECDC4\",\"#FFD93D\",\"#6BCB77\",\"#9B59B6\",\"#FF9F43\"]",
          "type": "png",
          "alias": "色板"
        }
      },
      "ui": {},
      "icon": {},
      "effect": {}
    },
    "audio": { "bgm": {}, "effect": {}, "voice": {} },
    "video": {}
  }
}